ID,Vendor,Text
165,Instagram Privacy,when we have good faith belief it is necessary to detect prevent and address fraud unauthorized use of the product violation of our term or policy or other harmful or illegal activity
166,Instagram Privacy,to protect ourselves including our right property or product you or others including a part of investigation or regulatory inquiry
167,Instagram Privacy,or to prevent death or imminent bodily harm
168,Instagram Privacy,for example if relevant we provide information to and receive information from third party partner about the reliability of your account to prevent fraud abuse and other harmful activity on and off our product
169,Instagram Privacy,information we receive about you including financial transaction data related to purchase made with facebook can be accessed and preserved for an extended period when it is the subject of legal request or obligation governmental investigation or investigation of possible violation of our term or policy or otherwise to prevent harm
170,Instagram Privacy,we also retain information from account disabled for term violation for at least year to prevent repeat abuse or other term violation
172,Instagram Privacy,how do we operate and transfer data a part of our global service we share information globally both internally within the facebook company and externally with our partner and with those you connect and share with around the world in accordance with this policy
173,Instagram Privacy,your information may for example be transferred or transmitted to or stored and processed in the united state or other country outside of where you live for the purpose a described in this policy
174,Instagram Privacy,these data transfer are necessary to provide the service set forth in the facebook term and instagram term and to globally operate and provide our product to you
175,Instagram Privacy,we utilize standard contract clause rely on the european commission adequacy decision about certain country a applicable and obtain your consent for these data transfer to the united state and other country
176,Instagram Privacy,viii
177,Instagram Privacy,how will we notify you of change to this policy we ll notify you before we make change to this policy and give you the opportunity to review the revised policy before you choose to continue using our product
179,Instagram Privacy,how to contact facebook with question you can learn more about how privacy work on facebook and on instagram
180,Instagram Privacy,if you have question about this policy you can contact u a described below
181,Instagram Privacy,we may resolve dispute you have with u in connection with our privacy policy and practice through trustarc
182,Instagram Privacy,you can contact trustarc through it website
183,Instagram Privacy,you can contact u online or by mail at facebook inc
184,Instagram Privacy,attn privacy operation 1601 willow road menlo park ca 94025 privacy notice for california residentsif you are california resident you can learn more about your consumer privacy right by reviewing the california privacy notice
185,Instagram Privacy,date of last revision august 21 2020
