ID,Vendor,Text
157,Apple Privacy,apple a global company ha number of legal entity in different jurisdiction which are responsible for the personal information which they collect and which is processed on their behalf by apple inc
158,Apple Privacy,for example point of sale information in our retail entity outside the u
159,Apple Privacy,is controlled by our individual retail entity in each country
160,Apple Privacy,apple online store and itunes related personal information may also be controlled by legal entity outside the u
161,Apple Privacy,a reflected in the term of each service
162,Apple Privacy,imagery and associated data collected by apple around the world to improve apple map and in support of our look around feature is transferred to apple inc in california
163,Apple Privacy,apple abides by the asia pacific economic cooperation apec cross border privacy rule system
164,Apple Privacy,the apec cbpr system provides framework for organization to ensure protection of personal information transferred among participating apec economy
165,Apple Privacy,if you have an unresolved privacy or data use concern regarding our apec cbpr and or prp certification please visit our third party dispute resolution provider
166,Apple Privacy,our companywide commitment to your privacy to make sure your personal information is secure we communicate our privacy and security guideline to apple employee and strictly enforce privacy safeguard within the company
167,Apple Privacy,privacy question if you have any question or concern about apple privacy policy or data processing you would like to contact our data protection officer or if you would like to make complaint about possible breach of local privacy law please contact u
168,Apple Privacy,you can always contact u by phone at the relevant apple support number for your country or region
169,Apple Privacy,when privacy question or question about personal information received in response to an access download request is received we have dedicated team which triage your contact to address your issue
170,Apple Privacy,where your issue may be more substantive in nature we may request more information from you
171,Apple Privacy,all such substantive contact receive response within seven 7 day wherever possible providing response on the issue raised requesting additional information where necessary or indicating that response will require additional time
172,Apple Privacy,you may at any time refer your complaint to the relevant regulator in your jurisdiction if you are unsatisfied with reply received from u
173,Apple Privacy,if you ask u we will endeavor to provide you with information about relevant complaint avenue which may be applicable to your circumstance
174,Apple Privacy,where your complaint indicates an improvement could be made in our handling of privacy issue we will take step to make such an update at the next reasonable opportunity
175,Apple Privacy,in the event that privacy issue ha resulted in negative impact on you or another person we will take step to address that with you or that other person
176,Apple Privacy,apple may update it privacy policy from time to time
177,Apple Privacy,when we change the policy in material way notice will be posted on our website along with the updated privacy policy
178,Apple Privacy,we will also contact you via your contact information on file for example by email notification or some other equivalent method
179,Apple Privacy,apple inc
180,Apple Privacy,one apple park way cupertino california usa 95014
