ID,Vendor,Text
0,Fandango Privacy,going back to movie theater read more gift card offer sign in sign out fandango screen reader user to optimize your experience with your screen reading software please use our flixster
1,Fandango Privacy,com website which ha the same ticket a our fandango
2,Fandango Privacy,com and movietickets
3,Fandango Privacy,com website
4,Fandango Privacy,skip to main content go movie now playing see all now playing opening this week limited release the croods new age 2020 stardust 2020 see all opening this week coming soon wonder woman 1984 monster hunter 2020 peter rabbit 2 the runaway see all coming soon explore more watch trailer on movieclips top box office new for streaming theater ticket where are you located here are our top city new york ny los angeles ca atlanta ga chicago il austin tx miami fl san francisco ca phoenix az washington dc boston ma san diego ca seattle wa edison nj houston tx tampa fl find theater movie time near find movie time ticket movie news featured movie news sean patrick flannery is black belt mickey kelly in this exclusive trailer for born champion read more what to watch on fandangonow the new mutant the personal history of david copperfield and more read more this week in movie news marvel studio set deadpool 3 another pink panther reboot and more read more explore content movie review home for the holiday award watch indie movie guide family guide house of scream weekly ticket my vip account join fandangovip buy movie
5,Fandango Privacy,get movie
6,Fandango Privacy,earn 125 point on every ticket you buy
7,Fandango Privacy,rack up 500 point and you ll score 5 reward for more movie
8,Fandango Privacy,learn more insider perk get your swag on with discounted movie to stream at home exclusive movie gear access to advanced screening and discount galore
9,Fandango Privacy,learn more partner reward collect bonus reward from our many partner including amc stub cinemark connection regal crown club when you link account
10,Fandango Privacy,learn more refund exchange we know life happens so if something come up you can return or exchange your ticket up until the posted showtime
11,Fandango Privacy,learn more join fandango vip for free it only take few second to join already fandango vip sign in privacy policy privacy policy term and policy term of use ticket policy promo code policy gift card term cooky and tracking fandangonow and vudu policy vip program term privacy policyterms and policiesterms of useticket policypromo code policygift card termscookies and trackingfandangonow and vudu policyvip program term download translation en español en français auf deutsch last updated august 18 2020 this privacy policy explains how fandango medium llc and it subsidiary company including the business operating under the fandango fandangonow vudu rotten tomato flixster movieclips movie
12,Fandango Privacy,com activaterewards
13,Fandango Privacy,com movietickets
14,Fandango Privacy,com or go brand fandango we our or u collect use and share information from or about you when you use our website downloadable application interactive tv application voice activated skill other digital service connected device and off line service that link to this policy or if you generate rating review public comment content on our property or engage in business with u the service
15,Fandango Privacy,note that this privacy policy doe not apply to our movie ticketing business that operates in latin america a that business ha separate privacy policy
16,Fandango Privacy,our owner when the service receive or collect information that information is being received and collected and will be owned by fandango and each of fandango owner i
17,Fandango Privacy,each company that ha an ownership interest in fandango
18,Fandango Privacy,while fandango use handling disclosure and practice with respect to that information will be governed by this privacy policy each fandango owner use handling disclosure and practice with respect to that information will be governed by that fandango owner privacy policy
19,Fandango Privacy,fandango owner are currently nbcuniversal and warner bros
20,Fandango Privacy,if you want to learn more about the privacy practice of nbcuniversal and warner bros
21,Fandango Privacy,we encourage you to review their policy linked below nbcuniversal privacy policy warner bros
22,Fandango Privacy,privacy policy your right to dispute your use of our website and our other service are subject to binding individual arbitration of any dispute which may arise a provided in the term and policy
23,Fandango Privacy,please read the arbitration provision of the term and policy carefully and do not use the service if you are unwilling to arbitrate any dispute you may have with u a provided in our term and policy
24,Fandango Privacy,please read this privacy policy carefully to understand how we handle your information
25,Fandango Privacy,by using the service you acknowledge you have read and understand this privacy policy and that we will collect use and share your information a set forth below
26,Fandango Privacy,table of content personal information we collect and purpose when we share your information legal base for use of your information child your right your choice how we protect your information international transfer update to our privacy policy contact u 1
27,Fandango Privacy,personal information we collect and purpose the table below explain the category of information we collect and the purpose for which we use them
28,Fandango Privacy,please note that we may use any or all of this information to comply with the law detect or prevent fraud and to defend our legal right
29,Fandango Privacy,further detail about each of the purpose is set out in the additional information on purpose of use table below
30,Fandango Privacy,information you provide to u category of personal information we collect purpose of use contact information and account registration for example name email postal address telephone number account user name and password business contact information and any information you may provide to u at an event or in person
31,Fandango Privacy,provide the service personalize your experience send you marketing communication provide seamless experience across platform and device protect our user service and property build and manage business to business relationship market and advertise for third party identification and demographic for example date of birth gender nationality ethnicity interest lifestyle information photo social medium credential including identification information about friend contact or referral you provide
32,Fandango Privacy,provide the service personalize your experience send you marketing communication provide seamless experience across platform and device protect our user service and property market and advertise for third party saved preference for example when you save on the service your favorite theater favorite movie or genre or city or zip code theater preference
33,Fandango Privacy,provide the service personalize your experience send you marketing communication provide seamless experience across platform and device protect our user service and property market and advertise for third party transactional for example credit debit card detail other payment detail e
34,Fandango Privacy,paypal venmo purchase history delivery address membership information reservation loyalty program membership or subscription for company or service other than fandango and the personal detail of any of your guest
35,Fandango Privacy,provide the service personalize your experience send you marketing communication provide seamless experience across platform and device protect our user service and property market and advertise for third party user generated content for example photo video audio and other information you may submit to u such a rating review or comment on our forum
36,Fandango Privacy,provide the service personalize your experience send you marketing communication provide seamless experience across platform and device protect our user service and property market and advertise for third party research and feedback for example comment that you send u through online form and social medium platform by email over the phone by mail or in survey
37,Fandango Privacy,provide the service personalize your experience send you marketing communication provide seamless experience across platform and device protect our user service and property market and advertise for third party biometric identifier for example facial scan or fingerprint
38,Fandango Privacy,provide the service personalize your experience provide seamless experience across platform and device protect our user service and property audio and video for example audio recording of customer service call or security video footage if you visit one of our property
39,Fandango Privacy,provide the service personalize your experience protect our user service and property information we collect automatically from you and or your device category of personal information we collect purpose of use device information and identifier for example ip address cookie id browser type and language operating system platform type device type and advertising and app identifier
40,Fandango Privacy,provide the service personalize your experience send you marketing communication provide seamless experience across platform and device protect our user service and property market and advertise for third party connection and usage for example domain name browsing activity scrolling and keystroke activity theater searched location searched movie searched show viewed movie trailer or other advertisement viewed form or field you complete or partially complete search term whether you open an email content you view and duration quality of the service and interaction with the content log and other similar information
41,Fandango Privacy,if these event occur while you are offline they may be logged and uploaded to u when you next connect
42,Fandango Privacy,provide the service personalize your experience send you marketing communication provide seamless experience across platform and device protect our user service and property market and advertise for third party geolocation for example city state and zip code associated with your ip address or derived through wi fi triangulation
43,Fandango Privacy,we will ask for your permission before using your precise location from gps based functionality on your mobile device
44,Fandango Privacy,provide the service personalize your experience send you marketing communication provide seamless experience across platform and device protect our user service and property market and advertise for third party information we collect from third party category of personal information we collect purpose of use source of information information from public and commercial source for example demographic and contact information information about other member of your household inference about your preference loyalty program membership or subscription for company or service other than fandango and purchasing data
45,Fandango Privacy,provide the service personalize your experience send you marketing communication provide seamless experience across platform and device build and manage business to business relationship market and advertise for third party advertising provider analytics provider marketer partner such a for sweepstakes partner consumer data resellers public record database social medium information for example if you interact with u through social medium service or log in using social medium credential depending on your social medium setting we may have access to your information from that social network such a your name email address friend list photo age gender location birthday social networking id current city your comment about the service and the people site you follow
46,Fandango Privacy,provide the service personalize your experience send you marketing communication provide seamless experience across platform and device market and advertise for third party social medium network partner of social medium network advertising provider analytics provider marketer partner such a for sweepstakes partner consumer data resellers additional information that we collect for business relationship only category of personal information we collect purpose of use source of information business contact information for example company name your name email address and job
47,Fandango Privacy,build and manage business relationship you your company trade association social medium business data resellers due diligence information for example contact information nationality job title age date of birth gender country of residence employment and education information public religious political or trade union role personal and professional affiliation connection to criminal activity or offense related to money laundering
48,Fandango Privacy,compliance and risk management activity for business relationship your or your company response to our due diligence question third party compliance screening tool and database such a those provided by lexisnexis risk solution
49,Fandango Privacy,click here for more information
50,Fandango Privacy,additional information on purpose of use provide the service for example responding to your request or inquiry including technical support sending you service related communication providing ticketing payment service mapping guidance and offer displaying content you generate such a video and comment carrying out research and analytics for us including improving the service and developing new one processing your information for promotional campaign such a sweepstakes and contest and for survey online and offline panel and focus group personalize the experience for example providing you with customized product experience including personalized newsletter viewing and other content recommendation from our partner and other organization
51,Fandango Privacy,providing you with advertising based on your activity and interest including at household level creating and updating profile and audience segment that can be used for analytics interest based advertising and marketing on the service television third party service and platform mobile apps and or website connected device and offline using inference about your preference and interest for any and all of the above purpose send marketing communication with consent if required for example sending you newsletter survey and information about product service and promotion provide seamless experience across platform and device for example identifying you when you log into the service on multiple device or web browser to provide continuity and to match your interest across device for the purpose of analytics advertising reporting and to improve the service identifying you if your device have attribute suggesting that they may be used by the same individual or household for purpose of analytics advertising reporting and to improve the service build and manage business relationship for example pursuing potential business opportunity including identifying and contacting the correct person within the company sending communication for business purpose sending event invitation marketing email and campaign and tracking the effectiveness of such communication providing business contact with access to our system and managing that access market and advertise for third party for example send you newsletter promotional email survey and information about product service and promotion offered by our partner and other organization with which we work customize content that our third party partner deliver on the service e
52,Fandango Privacy,personalized third party advertising create and update inference about you and audience segment that can be used for interest based advertising and marketing on the service third party service and platform and mobile apps create profile about you including adding and combining information we obtain from third party and matching your interest across device which may be used for third party marketing and advertising on the service television third party service and platform mobile apps and or website connected device and offline compliance and risk management activity for business relationship for example compliance with law and regulation managing third party and other risk to our business protecting the reputation of our business following the principle of ethical business conduct set out in our code of conduct protect our user service and property for example protecting the safety and security of user and visitor to the service protecting our digital and physical property detecting and preventing other activity that may be illegal or in violation of our term of service we may combine all the information we collect from or receive about you for the outlined purpose
53,Fandango Privacy,we may aggregate or deidentify your information and may use share rent or sell aggregated or deidentified information for any purpose and such information is not subject to this privacy policy
54,Fandango Privacy,sale of personal information if you or someone acting on your behalf would like to request that we do not sell your personal information you can either click here for such request or send an email to donotsell fandango
56,Fandango Privacy,you will also need to clear your cooky and re set your maid a referenced in the link
57,Fandango Privacy,for more information about how to opt out of receiving targeted advertising from certain third party advertiser please see our cooky notice
58,Fandango Privacy,for vudu which fandango acquired from walmart if you are california resident and you or someone acting on your behalf would like to request that vudu doe not sell your personal information you can either click here or call 800 925 6278 and walmart will process your request on vudu behalf
60,Fandango Privacy,when we share your information we may share your information with theater and event provider we may share information so that they may admit you or address customer service issue at the theater or venue or help process your ticketing or transaction or otherwise to fulfill the service
61,Fandango Privacy,advertiser advertising network and other third party we may share information about how you use the service and interact with content or ad to better tailor service product marketing and advertising on the service and on third party platform
62,Fandango Privacy,to enable these purpose we may share certain demographic information user generated content device information and identifier connection and usage data geolocation data public and commercial information and social medium information
63,Fandango Privacy,these third party may use their own tracking technology to collect or request information about you please see our cooky notice
64,Fandango Privacy,partner we may share your information with third party partner
65,Fandango Privacy,for instance if you enter contest promotion or sweepstakes sponsored by third party we may share the information you provide for that entry with the sponsor
66,Fandango Privacy,depending on the partnership we may share certain information including contact information at your direction identification and demographic information transactional information user generated content that you provide research and feedback device information and identifier connection and usage information public and commercial information and social medium information
67,Fandango Privacy,we may also share your information with third party that provide video locker service if you purchase movie or other show to view at home
68,Fandango Privacy,example of such third party would be movie anywhere
69,Fandango Privacy,similarly we may share your information with the provider of loyalty program if you take an action in the service indicating that you would like to obtain benefit under such program through activity on the service
70,Fandango Privacy,social network we may share your information with social medium platform for example if you click on facebook like button on the service the like may appear on your facebook account
71,Fandango Privacy,to control this sharing of information please review and adjust your privacy setting for the relevant social network
72,Fandango Privacy,depending on your privacy setting and action on such network we may share contact information identification and demographic information user generated content device information and identifier connection and usage data and social medium information
73,Fandango Privacy,service provider we engage vendor to perform service for business purpose on our behalf and share information with them to enable them to provide u with such service including research and analytics hosting transaction and payment processing promotion administration fraud prevention identity management acquisition and other service
74,Fandango Privacy,service provider may use such information for their operational purpose in order to provide their service to u
75,Fandango Privacy,research and measurement company we may share information about content you view on the service with video measurement service such a nielsen tv rating a well a other analytics provider
76,Fandango Privacy,see your right and your choice section for more information
77,Fandango Privacy,search engine you may be able to engage with other member of the service or the public
78,Fandango Privacy,this may make the name and photo associated with your profile and any comment or user generated content you provide visible to other member of the service or the general public
79,Fandango Privacy,if the information is available to the general public it may also be searchable by search engine
80,Fandango Privacy,law enforcement regulator anti fraud coalition and other group we share any of the category of information we collect a appropriate with these third party in order to protect and enforce the legal right privacy and safety of ourselves and our visitor
81,Fandango Privacy,protect against possible fraud or other illegal activity
82,Fandango Privacy,respond to request from government and other authority
83,Fandango Privacy,and otherwise comply with legal process
84,Fandango Privacy,other sharing we may share information about you often along with hashed or masked identifier with third party so they may better personalize your experience with them and the advertising and other offer they show or otherwise send you and to determine advertising effectiveness
85,Fandango Privacy,with your appropriate consent when required and consistent with applicable law we may share your video viewing behavior with third party including service provider advertising company analytics partner and social medium site
86,Fandango Privacy,sale or transfer of all or part of our business or asset in the event that fandango or any fandango business is involved in merger acquisition transfer of control bankruptcy reorganization or sale of asset or diligence associated with such matter we may sell or transfer the information described in this privacy policy a part of that transaction
87,Fandango Privacy,sale of personal information under california law certain of the information sharing described above may be categorized a the sale of personal information under certain circumstance
88,Fandango Privacy,california law broadly defines sale in way that may include allowing third party to receive certain information such a cooky ip address and or browsing behavior to add to profile about your device browser or you
89,Fandango Privacy,this profile may enable delivery of interest based advertising on the service or other site
90,Fandango Privacy,depending on what service you use we may share the following category of information for such advertising which may be considered sale a defined by california law identification and demographic
91,Fandango Privacy,device information and identifier such a ip address and unique advertising identifier and cooky
92,Fandango Privacy,connection and usage information such a browsing history or app usage
93,Fandango Privacy,geolocation information such a city
94,Fandango Privacy,and inference data
95,Fandango Privacy,to the extent that it doe constitute such sale you may opt out of that sale through the mechanism described below
97,Fandango Privacy,legal base for use of your information law other than the federal state and local law of the united state do not apply to our watch at home movie service e
98,Fandango Privacy,fandangonow go and vudu a content from those service can be viewed only in the united state
99,Fandango Privacy,similarly for our movie ticketing service e
100,Fandango Privacy,flixster fandango
101,Fandango Privacy,com and movietickets
102,Fandango Privacy,com the only law that shall apply are the law of the country in which the theater ticketed by each respective service are located
103,Fandango Privacy,the information set forth below in this section is applicable only to european user of rotten tomato
104,Fandango Privacy,it supplement certain section of this privacy policy and provides additional information that should be read together with other section of this privacy policy
105,Fandango Privacy,to the extent there is any conflict between this section and another section of this privacy policy this section shall govern
106,Fandango Privacy,when this policy mention fandango we our or u it refers to the company or company responsible for your information under this privacy policy or data controller
